text,label
My CPK levels are elevated.,common_side_effects_and_adverse_reactions
Bye bye.,goodbye
What is the capital of Austria?,unrelated
"Understood, goodbye.",goodbye
Is it okay to use hair removal creams?,lifestyle_restrictions
I'm withdrawing from my friends.,mental_health_warnings
"Hi, question about pregnancy risks.",greeting
I agree to stop if I feel worthless.,mental_health_warnings
Can I take antidepressants?,drug_and_supplement_interactions
Can this medication cause diabetes?,common_side_effects_and_adverse_reactions
"That answers my question, bye.",goodbye
Does the drug cause violent behaviors?,mental_health_warnings
Adios.,goodbye
Can this drug cause peeling of palms and soles?,common_side_effects_and_adverse_reactions
"Good morning, I hope you can help.",greeting
Do you have a medical license?,bot_identity_and_disclaimer
Nobody knows if Accutane caused the suicide.,mental_health_warnings
Can I use self-tanning lotions?,lifestyle_restrictions
Take care.,goodbye
End chat.,goodbye
I'm leaving.,goodbye
Can I take melatonin?,drug_and_supplement_interactions
Sayonara.,goodbye
"If I weigh 70 kg, should I take 70 mg a day?",dosage_and_administration
The pharmacy refused to fill it because the sticker was missing.,prescription_process_and_smart_program
"Hi, I have a query about a pill.",greeting
Can I take vitamin A supplements while on Accutane?,drug_and_supplement_interactions
Should I call my prescriber right away if I'm angry?,mental_health_warnings
Is it safe to use micro-dosed progesterone preparations?,pregnancy_and_contraception_risks
Can I take creatine?,drug_and_supplement_interactions
What is the longest river in the world?,unrelated
What is the hottest pepper in the world?,unrelated
How do I make slime?,unrelated
Do I have to see my doctor every month to get a new script?,prescription_process_and_smart_program
What is the capital of the Netherlands?,unrelated
Is this program mandatory for everyone?,prescription_process_and_smart_program
Is it safe to play sports that might cause bone fractures?,lifestyle_restrictions
"Hello, I was told to ask you some questions.",greeting
Can I take minocycline for my acne while on Accutane?,drug_and_supplement_interactions
What is skeletal hyperostosis?,common_side_effects_and_adverse_reactions
Can other medicines make my birth control pills fail?,pregnancy_and_contraception_risks
I must not breastfeed while taking this medication.,pregnancy_and_contraception_risks
Can I take pre-workout?,drug_and_supplement_interactions
Good morning.,greeting
Why is it called a 'systemic retinoid'?,indications_and_efficacy
Does the prescription expire after 7 days?,dosage_and_administration
How do I fix a flat tire on a bike?,unrelated
Can I take protein powder?,drug_and_supplement_interactions
Can you tell me a joke about a programmer?,unrelated
What is the largest mammal?,unrelated
"Hi, are you a bot?",greeting
Is it indicated for children?,indications_and_efficacy
How do I make a protein shake?,unrelated
Can the doctor adjust my dose during treatment?,dosage_and_administration
What counts as a primary form of contraception?,pregnancy_and_contraception_risks
I'm all set.,goodbye
"Thanks, take care.",goodbye
Why is it not indicated for mild acne?,indications_and_efficacy
Recommend a good sci-fi movie on Netflix.,unrelated
Is the goal complete clearance or just improvement?,indications_and_efficacy
What is the smallest country in the world?,unrelated
Have a safe day.,goodbye
Can I stop after 2 months if I'm better?,dosage_and_administration
Did lower dosages require more retreatment in studies?,dosage_and_administration
What is the S.M.A.R.T. program mentioned on my prescription?,prescription_process_and_smart_program
Who is the lead singer of Coldplay?,unrelated
How do I get a job at Google?,unrelated
Do I need a new sticker if the pharmacy is out of stock?,prescription_process_and_smart_program
Should I always take Accutane capsules with food?,dosage_and_administration
Can I get a chemical peel?,lifestyle_restrictions
Can it cause bleeding gums?,common_side_effects_and_adverse_reactions
Why are my lips so dry and cracked?,common_side_effects_and_adverse_reactions
Will it clear up my face and my back?,indications_and_efficacy
Can I take St. John's Wort?,drug_and_supplement_interactions
Can I lift heavy weights?,lifestyle_restrictions
Will my oil glands grow back after I stop?,indications_and_efficacy
"Hi, I'm looking for specific info.",greeting
"Hey, simple question.",greeting
No further questions.,goodbye
Should I swallow the capsule with liquid?,dosage_and_administration
Can I use lip balm?,lifestyle_restrictions
Hiya.,greeting
What is the capital of Denmark?,unrelated
What does the yellow self-adhesive sticker signify?,prescription_process_and_smart_program
Who is the richest actor?,unrelated
Does the sticker serve as documentation for the pharmacist?,prescription_process_and_smart_program
"I feel like hitting someone, is this the drug?",mental_health_warnings
How do I make french toast?,unrelated
Can it cause stroke?,common_side_effects_and_adverse_reactions
Will it reduce the size of my sebaceous glands?,indications_and_efficacy
Can I nurse my baby?,lifestyle_restrictions
Closing chat.,goodbye
Why shouldn't I take St. John's Wort while on birth control?,pregnancy_and_contraception_risks
Bye for now.,goodbye
Can I take diabetes medication?,drug_and_supplement_interactions
Do corneal opacities go away?,common_side_effects_and_adverse_reactions
What is the zip code for Beverly Hills?,unrelated
How do I make guacamole?,unrelated
"Hey there, I need some help.",greeting
Can Accutane cause depression?,mental_health_warnings
Is this confidential?,bot_identity_and_disclaimer
Should I look at the package insert of my other meds to check for interactions?,pregnancy_and_contraception_risks
Can I take herbal tea?,drug_and_supplement_interactions
How accurate are you?,bot_identity_and_disclaimer
Does it affect keratinization?,indications_and_efficacy
Why is the process so complicated for this drug?,prescription_process_and_smart_program
Will this help with scarring?,indications_and_efficacy
Who is the current Pope?,unrelated
Can I participate in sports?,lifestyle_restrictions
"I'm having crying spells, what should I do?",mental_health_warnings
What is the average temperature on Mars?,unrelated
Can this affect my bones?,common_side_effects_and_adverse_reactions
"Hello, system check.",greeting
Is the mechanism of action unknown?,indications_and_efficacy
I need to present the prescription with the sticker to the pharmacist.,dosage_and_administration
I need to watch for mental health issues as a serious side effect.,mental_health_warnings
"Very helpful, bye.",goodbye
Can I expect complete remission?,indications_and_efficacy
Where can I find the rates of contraception failure?,pregnancy_and_contraception_risks
What are the symptoms of pseudotumor cerebri?,common_side_effects_and_adverse_reactions
My parents should read the informed consent about mental problems.,mental_health_warnings
Do females of childbearing potential need a confirmatory test?,pregnancy_and_contraception_risks
"Nope, that's it.",goodbye
Should men use a condom for 30 days after an overdose?,dosage_and_administration
Can I stop using birth control during treatment?,lifestyle_restrictions
Can I use implantable contraceptives?,drug_and_supplement_interactions
Do you know my name?,bot_identity_and_disclaimer
How does a mail-order pharmacy check the 7-day window?,prescription_process_and_smart_program
Is it the most effective treatment available?,indications_and_efficacy
"If the pharmacy orders it, will I miss my 7-day window?",prescription_process_and_smart_program
Should I avoid going out in the sun?,lifestyle_restrictions
Bye now.,goodbye
Can you help me debug my Python code?,unrelated
Who wrote the Odyssey?,unrelated
I need to sign the patient agreement before getting the sticker.,prescription_process_and_smart_program
What is the capital of Belgium?,unrelated
Do you have a physical body?,bot_identity_and_disclaimer
Can I have laser skin treatment?,lifestyle_restrictions
Do minipills contain estrogen?,drug_and_supplement_interactions
Will I be acne-free forever after one course?,indications_and_efficacy
Can I get a 90-day supply so I don't have to come back next month?,prescription_process_and_smart_program
Does it cause hypopigmentation?,common_side_effects_and_adverse_reactions
"Hi, I'm taking isotretinoin.",greeting
"Hi, FDA info needed.",greeting
Can my acne continue to improve after I stop taking the drug?,dosage_and_administration
Is hearing impairment a risk with this drug?,common_side_effects_and_adverse_reactions
Is once-daily dosing recommended?,dosage_and_administration
Is the indication strictly physical severity?,indications_and_efficacy
Can working out hard cause muscle damage on this drug?,common_side_effects_and_adverse_reactions
My doctor forgot to put a yellow sticker on the paper.,prescription_process_and_smart_program
Can you tell me what to do?,bot_identity_and_disclaimer
Are you a pharmacist?,bot_identity_and_disclaimer
Do you store my chat history?,bot_identity_and_disclaimer
Can I get a piercing?,lifestyle_restrictions
Who won the last election?,unrelated
Who manages this service?,bot_identity_and_disclaimer
Why do I need to drink a full glass of liquid?,dosage_and_administration
I agree to stop if my appetite changes.,mental_health_warnings
Is there a human checking your answers?,bot_identity_and_disclaimer
What is the capital of Italy?,unrelated
Can this drug make me feel anxious?,mental_health_warnings
Can you make an appointment for me?,bot_identity_and_disclaimer
Will this cure my acne permanently?,indications_and_efficacy
"Hey, I need assistance.",greeting
Could a bad headache be a sign of brain pressure?,common_side_effects_and_adverse_reactions
How long should I avoid pregnancy after an overdose?,dosage_and_administration
Is it 13-cis-retinoic acid?,indications_and_efficacy
"I'll come back later, bye.",goodbye
Is it indicated for adults over 18?,indications_and_efficacy
What is the exchange rate for the Euro today?,unrelated
I have to go to the office just to get the sticker?,prescription_process_and_smart_program
Is this drug for mild acne?,indications_and_efficacy
Can I take antacids?,drug_and_supplement_interactions
Should I report a pregnancy to the Roche program specialist?,pregnancy_and_contraception_risks
"Hi, I'm new here.",greeting
Does it cause hyperpigmentation?,common_side_effects_and_adverse_reactions
I have to verify I know the risk of fetal injury.,pregnancy_and_contraception_risks
Is it effective for trunk acne?,indications_and_efficacy
I need to use effective contraception for 30 days after stopping.,pregnancy_and_contraception_risks
Can I take cranberry supplements?,drug_and_supplement_interactions
Should I avoid herbal supplements?,drug_and_supplement_interactions
Do you know everything about Accutane?,bot_identity_and_disclaimer
"Hello, I'm writing on behalf of my son.",greeting
Is abstinence a valid method of birth control for this drug?,pregnancy_and_contraception_risks
Some people have committed suicide on this drug.,mental_health_warnings
Can I engage in vigorous physical activity?,lifestyle_restrictions
Can you identify my skin type?,bot_identity_and_disclaimer
Can it cause nail dystrophy?,common_side_effects_and_adverse_reactions
Can I take blood pressure medication?,drug_and_supplement_interactions
"If I overdose, should I check for pregnancy?",dosage_and_administration
"I have amenorrhea, when should I get my pregnancy test?",pregnancy_and_contraception_risks
Can the doctor just write 'qualified' on the paper instead of the sticker?,prescription_process_and_smart_program
Can I take this with antibiotics?,dosage_and_administration
Does it cause excessive thirst?,common_side_effects_and_adverse_reactions
"If I lose interest in activities, should I stop the drug?",mental_health_warnings
"My doctor said I have 'few' nodules, so I can't take it?",indications_and_efficacy
Did a human write your responses?,bot_identity_and_disclaimer
Can I take fish oil?,drug_and_supplement_interactions
"If I am male, do I need a pregnancy test?",pregnancy_and_contraception_risks
I am having trouble wearing my contact lenses.,common_side_effects_and_adverse_reactions
Is this conversation private?,bot_identity_and_disclaimer
"I have to read the 'Be Smart, Be Safe, Be Sure' booklet.",pregnancy_and_contraception_risks
I have feelings of worthlessness.,mental_health_warnings
Does the prescriber have to call Roche to get stickers?,prescription_process_and_smart_program
What is the best time to visit Hawaii?,unrelated
Can it cause color vision disorders?,common_side_effects_and_adverse_reactions
Can I drive home from work at night?,lifestyle_restrictions
My school performance is going down.,mental_health_warnings
How do I make a budget spreadsheet?,unrelated
How do I make a latte?,unrelated
What is the most popular sport in the world?,unrelated
Hello again.,greeting
Do I need to show my ID to pick this up?,prescription_process_and_smart_program
Can I take ginseng?,drug_and_supplement_interactions
Should I avoid UV rays?,lifestyle_restrictions
Is the treatment usually 15 to 20 weeks long?,dosage_and_administration
I must have a negative serum pregnancy test before my initial prescription.,pregnancy_and_contraception_risks
I don't enjoy sports anymore.,mental_health_warnings
Are you a retrieval system?,bot_identity_and_disclaimer
"Thanks for the info, bye.",goodbye
