text,label
Can I use lotion?,lifestyle_restrictions
Can I watch TV in the dark?,lifestyle_restrictions
Do I take it 2 times a day unless told otherwise?,dosage_and_administration
"Hello, I have a concern.",greeting
Why should this be reserved for patients unresponsive to other therapies?,indications_and_efficacy
Who starred in the movie Titanic?,unrelated
Why isn't one method of birth control enough?,pregnancy_and_contraception_risks
Is the decrease in sebum related to the dose I take?,indications_and_efficacy
Are you a verified source?,bot_identity_and_disclaimer
"Thanks for clarifying, goodbye.",goodbye
Who won the Super Bowl last year?,unrelated
Ciao.,goodbye
Are nodules the same as regular pimples?,indications_and_efficacy
Have a good day.,goodbye
What is the deadliest animal?,unrelated
Can I take allergy medication?,drug_and_supplement_interactions
"My doctor said this is for 'cystic' acne, is that the same as nodular?",indications_and_efficacy
Can I take vitamin E supplements?,drug_and_supplement_interactions
I feel depressed and anxious.,common_side_effects_and_adverse_reactions
Are you available 24/7?,bot_identity_and_disclaimer
Does taking tetracyclines increase the risk of pseudotumor cerebri?,drug_and_supplement_interactions
"I'm all set, bye.",goodbye
I need to tell my doctor if I take antidepressants.,mental_health_warnings
Can I get an emergency supply without the sticker?,prescription_process_and_smart_program
Should I avoid alcohol if my triglycerides are high?,lifestyle_restrictions
Does the booklet explain contraceptive failure rates?,pregnancy_and_contraception_risks
Can you feel pain?,bot_identity_and_disclaimer
I heard taking it with a high-fat meal helps absorption.,dosage_and_administration
It says it is indicated only for females who are not pregnant.,indications_and_efficacy
Who discovered America?,unrelated
Is it common for teenagers to get back pain on Accutane?,common_side_effects_and_adverse_reactions
Can I take sleeping aids?,drug_and_supplement_interactions
Is it better to take it twice a day?,dosage_and_administration
"I'm good, thanks.",goodbye
How do I change my Facebook password?,unrelated
I have feelings of inappropriate guilt.,mental_health_warnings
I heard women on the pill have still gotten pregnant on Accutane.,pregnancy_and_contraception_risks
Who pays for the pregnancy prevention counseling?,pregnancy_and_contraception_risks
What is the capital of South Korea?,unrelated
Hi there.,greeting
I can't focus at work.,mental_health_warnings
Are you a diagnostic tool?,bot_identity_and_disclaimer
Can I take vitamin A supplements while on this dosage?,dosage_and_administration
Have a nice evening.,goodbye
What happens if I get pregnant during treatment?,pregnancy_and_contraception_risks
How do I fix a leaking faucet?,unrelated
"Hi, are you the Accutane assistant.",greeting
I feel drowsy and lethargic.,common_side_effects_and_adverse_reactions
What is rhabdomyolysis?,common_side_effects_and_adverse_reactions
How do I block a number on my iPhone?,unrelated
Should I chew the capsule?,dosage_and_administration
What version of the software is this?,bot_identity_and_disclaimer
How do I fix a running toilet?,unrelated
"Hi, resuming our chat.",greeting
Can I use the mini-pill while on Accutane?,pregnancy_and_contraception_risks
Why shouldn't I wax my skin while on Accutane?,lifestyle_restrictions
What is the best pizza place in town?,unrelated
Will absorption decrease significantly without food?,dosage_and_administration
Who trained you?,bot_identity_and_disclaimer
Can I use a photocopy of the sticker?,prescription_process_and_smart_program
"Hello, can you answer medical questions.",greeting
Are you unbiased?,bot_identity_and_disclaimer
Why can't I donate blood for 30 days?,lifestyle_restrictions
Greetings and salutations.,greeting
How do I get a refund from Steam?,unrelated
"If swallowing is painful, should I call my doctor?",dosage_and_administration
"Goodbye, bot.",goodbye
What is the capital of Canada?,unrelated
How do I make a smoothie?,unrelated
How do I plant a tomato garden?,unrelated
I'm irritable and angry lately.,mental_health_warnings
Should I store the pills at room temperature?,dosage_and_administration
"Hey, anyone home?",greeting
"Good evening, support team.",greeting
Is it possible to have an allergic reaction?,common_side_effects_and_adverse_reactions
"Hi, let's get started.",greeting
What happens to my data?,bot_identity_and_disclaimer
How do I learn to play the guitar?,unrelated
How long is a single course of therapy?,dosage_and_administration
I feel like a bad person for no reason.,mental_health_warnings
How many continents are there?,unrelated
Can I trust your advice?,bot_identity_and_disclaimer
"Excellent, thanks, bye.",goodbye
How do I get to the nearest gas station?,unrelated
Bye.,goodbye
Who is the CEO of Tesla?,unrelated
I have protein in my urine.,common_side_effects_and_adverse_reactions
Can the dose go up to 2.0 mg/kg/day?,dosage_and_administration
Is Pluto considered a planet?,unrelated
I need to do monthly pregnancy avoidance counseling.,pregnancy_and_contraception_risks
Some patients developed serious mental problems shortly after stopping.,mental_health_warnings
Can I take hormone replacement therapy?,drug_and_supplement_interactions
Is there an interactive effect on bone loss with corticosteroids?,drug_and_supplement_interactions
How do I apply for a mortgage?,unrelated
How do I renew my passport?,unrelated
Should I stop driving if I can't see?,lifestyle_restrictions
I'm urinating frequently.,common_side_effects_and_adverse_reactions
Can my doctor call in the prescription over the phone?,dosage_and_administration
Is skin resurfacing safe while on the drug?,lifestyle_restrictions
How recent does the prescription need to be?,dosage_and_administration
I've been feeling sad since starting Accutane.,mental_health_warnings
Can I take this if I am on anticonvulsants?,dosage_and_administration
How do I make a paper airplane?,unrelated
Have there been documented cases of human fetal abnormalities?,pregnancy_and_contraception_risks
Will this help with my oily skin?,indications_and_efficacy
What is the main ingredient in hummus?,unrelated
Can I have unprotected sex?,lifestyle_restrictions
I have trouble swallowing.,common_side_effects_and_adverse_reactions
What is the difference between a crocodile and an alligator?,unrelated
What is your privacy policy?,bot_identity_and_disclaimer
I have stomach pain and diarrhea.,common_side_effects_and_adverse_reactions
Does it inhibit sebaceous gland differentiation?,indications_and_efficacy
"Hi, please help me.",greeting
Can I take vitamin supplements with Vitamin A?,lifestyle_restrictions
Is it safe to take doxycycline?,drug_and_supplement_interactions
"Alright, bye.",goodbye
Should I avoid heavy machinery?,lifestyle_restrictions
Can I take this for mild pimples if I want them gone fast?,indications_and_efficacy
How do I get a stain out of a white shirt?,unrelated
"I want to die, should I stop the pill?",mental_health_warnings
Later.,goodbye
Can I get the drug if I don't use contraception?,pregnancy_and_contraception_risks
Can this drug affect my liver enzymes?,common_side_effects_and_adverse_reactions
Does it work for everyone?,indications_and_efficacy
How do I write a check?,unrelated
Do I have to use birth control for a month before starting?,pregnancy_and_contraception_risks
Should I use combined oral contraceptives instead of minipills?,drug_and_supplement_interactions
"Got it, thanks, bye.",goodbye
Is this part of the Accutane Pregnancy Prevention Program?,prescription_process_and_smart_program
My weight has changed since starting Accutane.,mental_health_warnings
What if my doctor runs out of yellow stickers?,prescription_process_and_smart_program
How far is the moon from the earth?,unrelated
Do you have access to my webcam?,bot_identity_and_disclaimer
Can I take laxatives?,drug_and_supplement_interactions
Can Accutane interact with hormonal contraceptives?,drug_and_supplement_interactions
"Hello, chatbot.",greeting
Can it cause skin infections?,common_side_effects_and_adverse_reactions
Can Accutane cause headaches?,common_side_effects_and_adverse_reactions
My heart is racing (tachycardia).,common_side_effects_and_adverse_reactions
Can it cause cataracts?,common_side_effects_and_adverse_reactions
How do I get rid of fruit flies?,unrelated
Do I need blood tests during my monthly visits?,dosage_and_administration
Is sweating a side effect?,common_side_effects_and_adverse_reactions
Is neutropenia a side effect?,common_side_effects_and_adverse_reactions
What are the available strengths of Accutane capsules?,dosage_and_administration
How do you know this information?,bot_identity_and_disclaimer
Does the sticker have a serial number?,prescription_process_and_smart_program
Do I have to be reliable in following instructions to take this?,pregnancy_and_contraception_risks
Can you translate 'hello' into Spanish?,unrelated
Can my doctor call the pharmacy to authorize the refill?,prescription_process_and_smart_program
Do I need pregnancy prevention counseling before starting?,pregnancy_and_contraception_risks
I agree to tell my prescriber if my family has a history of suicide.,mental_health_warnings
Who was the first person on the moon?,unrelated
Will my pores get smaller?,indications_and_efficacy
Is rectal bleeding a side effect I should worry about?,common_side_effects_and_adverse_reactions
What is the recommended dosage range for Accutane?,dosage_and_administration
Cheerio.,goodbye
"Hello, begin session.",greeting
How do I stop my cat from scratching the furniture?,unrelated
What if I am postmenopausal?,pregnancy_and_contraception_risks
How do I bake a potato in the microwave?,unrelated
Does it shrink the oil glands?,indications_and_efficacy
Is the dose 0.5 mg/kg per day?,dosage_and_administration
Is the decrease in sebum related to how long I take it?,indications_and_efficacy
Can I transfer this prescription to another pharmacy?,prescription_process_and_smart_program
I'm heading out.,goodbye
"Okay, bye.",goodbye
I need to make sure my doctor has stickers in stock.,prescription_process_and_smart_program
Who is responsible for your answers?,bot_identity_and_disclaimer
Are you an AI?,bot_identity_and_disclaimer
What is the oldest university?,unrelated
Can I get two months' worth if I'm going on vacation?,prescription_process_and_smart_program
Exit.,goodbye
What is allergic vasculitis?,common_side_effects_and_adverse_reactions
How do I start a blog?,unrelated
Can I use a cervical cap as a secondary form of birth control?,pregnancy_and_contraception_risks
Do I need a yellow sticker for every prescription?,dosage_and_administration
Who wrote the Harry Potter books?,unrelated
When is the next leap year?,unrelated
How long should I wait before starting a second course?,dosage_and_administration
Does the mail-order pharmacy require the sticker?,prescription_process_and_smart_program
I received information on emergency contraception.,pregnancy_and_contraception_risks
Does conventional therapy include creams?,indications_and_efficacy
"No thanks, bye.",goodbye
What is the mechanism of action?,indications_and_efficacy
The yellow sticker documents that I am qualified.,pregnancy_and_contraception_risks
Should I avoid situations where I might get hurt?,lifestyle_restrictions
Will the pharmacy fill it without the sticker?,dosage_and_administration
"I want to get a leg wax, is that okay?",lifestyle_restrictions
How do I make a salad dressing?,unrelated
Can I work night shifts?,lifestyle_restrictions
"My acne is suppurative, is Accutane indicated?",indications_and_efficacy
Can I take diuretics?,drug_and_supplement_interactions
Can I get a tattoo?,lifestyle_restrictions
Are you approved by the FDA?,bot_identity_and_disclaimer
My pharmacy says they need a qualification sticker.,prescription_process_and_smart_program
Should I stop exercising if I have muscle pain?,lifestyle_restrictions
Can I just skip the missed dose?,dosage_and_administration
Is it effective in pediatric patients?,indications_and_efficacy
How do I learn to code?,unrelated
People have ended their own lives on this medication.,mental_health_warnings
Can I suck on the capsule?,dosage_and_administration
I need to take it for 15 weeks minimum.,dosage_and_administration
How do I change the oil in my car?,unrelated
Can I stop using birth control 1 month after treatment?,lifestyle_restrictions
Can I take fiber supplements?,drug_and_supplement_interactions
Who is the queen of pop?,unrelated
Thanks for your time.,goodbye
"Hello, I'm confused about my prescription.",greeting
Can I wear my contact lenses?,lifestyle_restrictions
Can I take cold medicine?,drug_and_supplement_interactions
What model are you running on?,bot_identity_and_disclaimer
Do I have to wait 6 months for laser procedures too?,lifestyle_restrictions
How do I calm down when I'm anxious?,unrelated
Terminate.,goodbye
Will this help if conventional therapy failed?,indications_and_efficacy
Is it normal to have temper outbursts?,mental_health_warnings
I agree to tell my prescriber if my family has a history of psychosis.,mental_health_warnings
I have red patches on my extremities.,common_side_effects_and_adverse_reactions
Who wrote the Lord of the Rings?,unrelated
Can you keep a secret?,bot_identity_and_disclaimer
I feel nauseous and have been vomiting.,common_side_effects_and_adverse_reactions
Can I take black cohosh?,drug_and_supplement_interactions
"For males, is the qualification date the day the prescription is written?",prescription_process_and_smart_program
How do I get rid of ants in the kitchen?,unrelated
How do I edit a PDF?,unrelated
Does this medication increase the risk of spontaneous abortion?,pregnancy_and_contraception_risks
What is the capital of Australia?,unrelated
I've lost interest in social activities.,mental_health_warnings
"Hi, I need the yellow sticker info.",greeting
How do I start a fire without matches?,unrelated
What is the formula for the area of a circle?,unrelated
Can I donate blood if I'm a male?,lifestyle_restrictions
"Hi, Accutane help.",greeting
Can you authorize a refill?,bot_identity_and_disclaimer
Are you a dermatologist?,bot_identity_and_disclaimer
Why is the dispensing window so short?,prescription_process_and_smart_program
Is the Medication Guide part of the risk management program?,prescription_process_and_smart_program
Hey.,greeting
Farewell.,goodbye
What is the population of Tokyo?,unrelated
Can I take energy drinks?,drug_and_supplement_interactions
Why are minipills considered an inadequate method of contraception?,drug_and_supplement_interactions
Should I be cautious using steroids and Accutane together?,drug_and_supplement_interactions
When would a doctor increase the dose to 2.0 mg?,dosage_and_administration
Can I get the yellow stickers myself?,prescription_process_and_smart_program
"Hello, I'm a patient taking Accutane.",greeting
Are you certified?,bot_identity_and_disclaimer
Who wrote the Declaration of Independence?,unrelated
Is it true that I can't determine which fetus is affected?,pregnancy_and_contraception_risks
"If I become more irritable than usual, should I call my doctor?",mental_health_warnings
Should I take two doses if I missed one?,dosage_and_administration
Can I opt out of the S.M.A.R.T. program?,prescription_process_and_smart_program
Can I take sleeping pills?,drug_and_supplement_interactions
How big does a lesion have to be to be considered a nodule?,indications_and_efficacy
"If the sticker isn't there, should I call the prescriber?",dosage_and_administration
Can I take diet pills?,drug_and_supplement_interactions
Are there cardiovascular abnormalities linked to Accutane?,pregnancy_and_contraception_risks
Can I take it for longer than the recommended duration?,dosage_and_administration
How do I make a reservation at a restaurant?,unrelated
Can I use moisturizer for my dry skin?,lifestyle_restrictions
"Hello, connect me.",greeting
What does psychosis mean?,mental_health_warnings
I'm having trouble concentrating.,mental_health_warnings
Should I avoid sunlight completely?,lifestyle_restrictions
What is the capital of Argentina?,unrelated
Is the sticker the only way to get the drug?,prescription_process_and_smart_program
How do I make a paper boat?,unrelated
"I'm done, thanks.",goodbye
"If I stop taking it, will the depression go away immediately?",mental_health_warnings
What is the weather like in New York today?,unrelated
Hey!,greeting
What is the heaviest land animal?,unrelated
"I'll take the test, bye.",goodbye
What is the square root of 144?,unrelated
Is it okay to take low doses for a long time?,dosage_and_administration
What is the most spoken language in the world?,unrelated
I'm withdrawing from my family.,mental_health_warnings
Is this advice legally binding?,bot_identity_and_disclaimer
Does it work for whiteheads?,indications_and_efficacy
I must stop taking Accutane if I miss my period.,pregnancy_and_contraception_risks
Can I take seizure medication?,drug_and_supplement_interactions
How do I boost my credit score?,unrelated
Should I avoid prolonged exposure to sunlight?,lifestyle_restrictions
What is benign intracranial hypertension?,drug_and_supplement_interactions
Explain the theory of relativity in simple terms.,unrelated
I'm getting sunburned really easily.,common_side_effects_and_adverse_reactions
Can I take it if I have mild acne but I'm depressed about it?,indications_and_efficacy
What is the process for qualifying a female patient?,prescription_process_and_smart_program
"Hey, I'm back with another question.",greeting
My mood has changed to being angry.,mental_health_warnings
"I feel anxious and empty, is that a side effect?",mental_health_warnings
"Perfect, goodbye.",goodbye
Why are there no refills permitted on this drug?,prescription_process_and_smart_program
Is it indicated for males with severe acne?,indications_and_efficacy
Are you HIPAA compliant?,bot_identity_and_disclaimer
"I'm sleeping too much, could it be the drug?",mental_health_warnings
My white blood cell count is low.,common_side_effects_and_adverse_reactions
What is your purpose?,bot_identity_and_disclaimer
I feel like I have no energy.,mental_health_warnings
"Hi, can you help me?",greeting
Does Accutane cause loss of contact with reality?,mental_health_warnings
Can I take it if the sticker date is more than 7 days ago?,dosage_and_administration
See you later.,goodbye
What kind of skull abnormalities can occur?,pregnancy_and_contraception_risks
How do I clear my browser cache?,unrelated
Signing off.,goodbye
Does conventional therapy include oral antibiotics?,indications_and_efficacy
"You answered everything, thanks.",goodbye
"My family has a history of mental illness, is that a problem?",mental_health_warnings
I've lost interest in sports I used to like.,mental_health_warnings
The pharmacy said my qualification date is too old.,prescription_process_and_smart_program
Good day.,goodbye
Can it cause anemia?,common_side_effects_and_adverse_reactions
What is the closest star to Earth?,unrelated
"I'll call my doctor, thanks, bye.",goodbye
Can it cause blood in the urine?,common_side_effects_and_adverse_reactions
Who is the Prime Minister of the UK?,unrelated
Can I take probiotics?,drug_and_supplement_interactions
How do I make a GIF?,unrelated
Will the manufacturer provide the pregnancy test kits?,pregnancy_and_contraception_risks
My partner and I need to be careful about pregnancy risks.,pregnancy_and_contraception_risks
Can I use a sunlamp?,lifestyle_restrictions
Can I use a diaphragm as my only method of protection?,pregnancy_and_contraception_risks
I don't want to see my friends anymore.,mental_health_warnings
Is decreased night vision permanent?,common_side_effects_and_adverse_reactions
What is the freezing point of alcohol?,unrelated
What is the 'Prescriber Checklist' mentioned in the S.M.A.R.T. letter?,prescription_process_and_smart_program
I need to make sure I don't self-medicate with herbal supplements.,dosage_and_administration
Can I take evening primrose oil?,drug_and_supplement_interactions
Did people get pregnant while taking St. John's Wort and Accutane?,pregnancy_and_contraception_risks
Is it possible to get pancreatitis from this?,common_side_effects_and_adverse_reactions
Can I donate blood immediately after my last dose?,lifestyle_restrictions
How do I format a USB drive?,unrelated
Can I take turmeric?,drug_and_supplement_interactions
Can you predict my side effects?,bot_identity_and_disclaimer
"Hello, I'm prescribing isotretinoin.",greeting
Can I walk outside during the day?,lifestyle_restrictions
Can I donate blood if I took too much Accutane?,dosage_and_administration
Is the prescription really only good for 7 days?,prescription_process_and_smart_program
Go away.,goodbye
What is your name?,bot_identity_and_disclaimer
Is dizziness a side effect?,common_side_effects_and_adverse_reactions
Is it true that Accutane is contraindicated for pregnant females?,pregnancy_and_contraception_risks
"Thanks, see you.",goodbye
Can I take vitamin B supplements?,drug_and_supplement_interactions
What is the capital of Thailand?,unrelated
Do you have malpractice insurance?,bot_identity_and_disclaimer
"Hi, nice to meet you.",greeting
Should I discuss continuing the pregnancy if I conceive?,pregnancy_and_contraception_risks
Why can't I use an online doctor for this?,prescription_process_and_smart_program
Finished.,goodbye
Do I have to get tested for pregnancy every single month?,pregnancy_and_contraception_risks
Can I get a refill if I have refills left on the bottle?,dosage_and_administration
Is it possible to become aggressive on this drug?,mental_health_warnings
What is the success rate?,indications_and_efficacy
Should I be cautious operating vehicles at night?,lifestyle_restrictions
Have a great day.,goodbye
Should I use two forms of birth control?,lifestyle_restrictions
Are micro-dosed progesterone preparations effective with Accutane?,drug_and_supplement_interactions
What is the best yoga pose for back pain?,unrelated
"I'll check the label, thanks, bye.",goodbye
Can I use public transport?,lifestyle_restrictions
Shut down.,goodbye
What is the best way to train a puppy?,unrelated
I have hives (urticaria).,common_side_effects_and_adverse_reactions
Can I bring the sticker to the pharmacy later?,prescription_process_and_smart_program
Should I get a Medication Guide every time I pick up the drug?,dosage_and_administration
Why do I get a Medication Guide every time I pick it up?,prescription_process_and_smart_program
How do I tie a Windsor knot?,unrelated
I have a rash on my arms.,common_side_effects_and_adverse_reactions
Does the prescriber have to obtain the stickers from the manufacturer?,prescription_process_and_smart_program
Does psychosis mean hearing voices?,mental_health_warnings
"Hello, Isotretinoin help.",greeting
Who discovered penicillin?,unrelated
Should I avoid sports with repetitive impact?,lifestyle_restrictions
Can Accutane make my birth control pills less effective?,pregnancy_and_contraception_risks
Can you refuse to answer?,bot_identity_and_disclaimer
What are corneal opacities?,common_side_effects_and_adverse_reactions
"If I only have a few nodules, can I take this?",indications_and_efficacy
Can I renew the prescription over the phone?,prescription_process_and_smart_program
What are the rules of chess?,unrelated
What is the most expensive car?,unrelated
Can you see my medical records?,bot_identity_and_disclaimer
IUDs are considered primary methods.,pregnancy_and_contraception_risks
Is 5 mm the size of a nodule?,indications_and_efficacy
Why does my doctor need to know about unplanned pregnancy risks?,pregnancy_and_contraception_risks
Can I take collagen?,drug_and_supplement_interactions
Does it help with draining sinuses?,indications_and_efficacy
I read that I must not get pregnant while on this medication.,pregnancy_and_contraception_risks
Can the capsule irritate my esophagus?,dosage_and_administration
How do I make iced tea?,unrelated
I have conjunctivitis (pink eye).,common_side_effects_and_adverse_reactions
How do I fix a squeaky door?,unrelated
Talk to you later.,goodbye
Can you solve this differential equation for me?,unrelated
Can I take antibiotics for an infection?,drug_and_supplement_interactions
What is the capital of Sweden?,unrelated
Can I rely on just condoms?,lifestyle_restrictions
My sleeping habits have changed.,mental_health_warnings
Can I share my medication with my friend who has acne?,lifestyle_restrictions
What is the capital of Portugal?,unrelated
I need to avoid unplanned pregnancy.,pregnancy_and_contraception_risks
Can I go to the beach for vacation?,lifestyle_restrictions
Write a poem about a lonely robot.,unrelated
My blood sugar is higher than normal.,common_side_effects_and_adverse_reactions
Does an overdose cause vomiting or facial flushing?,dosage_and_administration
Who programmed you?,bot_identity_and_disclaimer
How do I install Windows 11?,unrelated
How do I remove malware from my PC?,unrelated
Do corticosteroids cause osteoporosis?,drug_and_supplement_interactions
Can I take mood stabilizers?,drug_and_supplement_interactions
Is the yellow sticker a federal requirement?,prescription_process_and_smart_program
What is the capital of Egypt?,unrelated
How do I boil an egg?,unrelated
I'm closing the window.,goodbye
How do I make a vision board?,unrelated
What is the atomic number of Gold?,unrelated
How do I make a grilled cheese sandwich?,unrelated
